{
  "$schema": "http://json-schema.org/draft-07/schema#",
  "$id": "https://bindle/schemas/architecture/v1/apply-state.schema.json",
  "title": "architecture v1 apply-state manifest",
  "description": "Interrupted-apply recovery metadata ONLY, with no semantic role whatsoever: losing this file can never change what the projection means, only whether an interrupted write needs resuming. It is created only for a NON-EMPTY changed set -- a semantic no-op writes zero bytes and creates no manifest at all -- after the plan is validated and before the first write. It claims no cross-file filesystem atomicity: atomicity is per file, and cross-file integrity comes from this manifest plus resume.",
  "type": "object",
  "additionalProperties": false,
  "required": ["schema_version", "project_id", "status", "started_at", "writes"],
  "properties": {
    "schema_version": { "const": 1 },
    "project_id": { "type": "string", "pattern": "^project:[0-9a-f]{32}$" },
    "status": { "enum": ["in_progress", "complete"] },
    "started_at": { "type": "string", "format": "date-time" },
    "writes": {
      "type": "array",
      "minItems": 1,
      "items": {
        "type": "object",
        "additionalProperties": false,
        "required": ["order", "path", "after_hash", "state"],
        "properties": {
          "order": {
            "type": "integer",
            "minimum": 0,
            "description": "Dense and ascending from 0: deterministic write ordering is what makes 'advance after each write' unambiguous on resume."
          },
          "path": { "type": "string", "minLength": 1 },
          "before_hash": {
            "oneOf": [
              { "type": "string", "pattern": "^sha256:[0-9a-f]{64}$" },
              { "type": "null" }
            ],
            "description": "null when the file does not exist yet."
          },
          "after_hash": { "type": "string", "pattern": "^sha256:[0-9a-f]{64}$" },
          "state": { "enum": ["pending", "written"] }
        }
      }
    }
  }
}
